{"id":"Indigo","title":"Handle double negation.","description":"Selects \"courses_dept\", \"courses_id\", and \"courses_avg\" and looks for all courses with not not 60% average, sorted by courses_dept","query":{"WHERE":{"NOT":{"NOT":{"EQ":{"courses_avg":60}}}},"OPTIONS":{"COLUMNS":["courses_dept","courses_id","courses_avg"],"ORDER":"courses_dept"}},"isQueryValid":true,"result":[{"courses_avg":60,"courses_id":"441","courses_dept":"busi"},{"courses_avg":60,"courses_id":"444","courses_dept":"busi"},{"courses_avg":60,"courses_id":"417","courses_dept":"chem"},{"courses_avg":60,"courses_id":"417","courses_dept":"chem"},{"courses_avg":60,"courses_id":"110","courses_dept":"dhyg"},{"courses_avg":60,"courses_id":"401","courses_dept":"dhyg"},{"courses_avg":60,"courses_id":"405","courses_dept":"dhyg"},{"courses_avg":60,"courses_id":"405","courses_dept":"dhyg"},{"courses_avg":60,"courses_id":"432","courses_dept":"hist"},{"courses_avg":60,"courses_id":"303","courses_dept":"phar"},{"courses_avg":60,"courses_id":"120","courses_dept":"phil"},{"courses_avg":60,"courses_id":"100","courses_dept":"test"}]}
