{"id":"Mango","title":"Contradictory query should be valid.","description":"This test looks for a course that is in department \"adhe\" and not in \"adhe\". This contradictory query should return 0 results without error.","query":{"WHERE":{"AND":[{"GT":{"courses_avg":90}},{"IS":{"courses_dept":"adhe"}},{"AND":[{"IS":{"courses_id":"550"}},{"NOT":{"IS":{"courses_dept":"adhe"}}}]}]},"OPTIONS":{"COLUMNS":["courses_dept","courses_id","courses_avg"],"ORDER":"courses_avg"}},"isQueryValid":true,"result":[]}
