{"id":"Firefly","title":"Should be able to find all instructors in a dept with a partial name.","description":"Selects \"courses_dept\" and \"courses_instructor\", and looks for \"*a\" in \"courses_instructor\".","query":{"WHERE":{"AND":[{"IS":{"courses_instructor":"*a"}},{"IS":{"courses_dept":"cpsc"}}]},"OPTIONS":{"COLUMNS":["courses_dept","courses_instructor"]}},"isQueryValid":true,"result":[{"courses_dept":"cpsc","courses_instructor":"mcgrenere, joanna"},{"courses_dept":"cpsc","courses_instructor":"berg, celina"},{"courses_dept":"cpsc","courses_instructor":"berg, celina"},{"courses_dept":"cpsc","courses_instructor":"mcgrenere, joanna"},{"courses_dept":"cpsc","courses_instructor":"mcgrenere, joanna"},{"courses_dept":"cpsc","courses_instructor":"cooper, kendra"},{"courses_dept":"cpsc","courses_instructor":"baniassad, elisa"},{"courses_dept":"cpsc","courses_instructor":"baniassad, elisa"},{"courses_dept":"cpsc","courses_instructor":"baniassad, elisa"},{"courses_dept":"cpsc","courses_instructor":"baniassad, elisa"},{"courses_dept":"cpsc","courses_instructor":"munzner, tamara"},{"courses_dept":"cpsc","courses_instructor":"munzner, tamara"},{"courses_dept":"cpsc","courses_instructor":"darwish, mohammad mostafa"},{"courses_dept":"cpsc","courses_instructor":"munzner, tamara"},{"courses_dept":"cpsc","courses_instructor":"cooper, kendra"},{"courses_dept":"cpsc","courses_instructor":"sheffer, alla"},{"courses_dept":"cpsc","courses_instructor":"baniassad, elisa"},{"courses_dept":"cpsc","courses_instructor":"baniassad, elisa"},{"courses_dept":"cpsc","courses_instructor":"baniassad, elisa"},{"courses_dept":"cpsc","courses_instructor":"baniassad, elisa"},{"courses_dept":"cpsc","courses_instructor":"dunfield, joshua"},{"courses_dept":"cpsc","courses_instructor":"munzner, tamara"},{"courses_dept":"cpsc","courses_instructor":"sheffer, alla"},{"courses_dept":"cpsc","courses_instructor":"sheffer, alla"},{"courses_dept":"cpsc","courses_instructor":"munzner, tamara"},{"courses_dept":"cpsc","courses_instructor":"sheffer, alla"},{"courses_dept":"cpsc","courses_instructor":"munzner, tamara"},{"courses_dept":"cpsc","courses_instructor":"munzner, tamara"},{"courses_dept":"cpsc","courses_instructor":"conati, cristina"},{"courses_dept":"cpsc","courses_instructor":"conati, cristina"},{"courses_dept":"cpsc","courses_instructor":"conati, cristina"},{"courses_dept":"cpsc","courses_instructor":"conati, cristina"},{"courses_dept":"cpsc","courses_instructor":"conati, cristina"},{"courses_dept":"cpsc","courses_instructor":"conati, cristina"},{"courses_dept":"cpsc","courses_instructor":"dawson, jessica"},{"courses_dept":"cpsc","courses_instructor":"baniassad, elisa"},{"courses_dept":"cpsc","courses_instructor":"baniassad, elisa"},{"courses_dept":"cpsc","courses_instructor":"conati, cristina"},{"courses_dept":"cpsc","courses_instructor":"conati, cristina"},{"courses_dept":"cpsc","courses_instructor":"dawson, jessica"},{"courses_dept":"cpsc","courses_instructor":"mcgrenere, joanna"},{"courses_dept":"cpsc","courses_instructor":"mcgrenere, joanna"},{"courses_dept":"cpsc","courses_instructor":"mcgrenere, joanna"},{"courses_dept":"cpsc","courses_instructor":"dawson, jessica"},{"courses_dept":"cpsc","courses_instructor":"mcgrenere, joanna"},{"courses_dept":"cpsc","courses_instructor":"conati, cristina"},{"courses_dept":"cpsc","courses_instructor":"conati, cristina"},{"courses_dept":"cpsc","courses_instructor":"dawson, jessica"},{"courses_dept":"cpsc","courses_instructor":"mcgrenere, joanna"},{"courses_dept":"cpsc","courses_instructor":"munzner, tamara"},{"courses_dept":"cpsc","courses_instructor":"munzner, tamara"}]}
