{"id":"Elixir","title":"Should be able to find sections with an or query on different keys.","description":"This test gets the \"courses_dept\",\"courses_id\", \"courses_fail\", \"courses_avg\" columns for cpsc courses with average = 88, or math sections with 20 < courses_fail < 30, sorted by courses_avg","query":{"WHERE":{"OR":[{"AND":[{"EQ":{"courses_avg":88}},{"IS":{"courses_dept":"cpsc"}}]},{"AND":[{"LT":{"courses_fail":30}},{"GT":{"courses_fail":20}},{"IS":{"courses_dept":"math"}}]}]},"OPTIONS":{"COLUMNS":["courses_dept","courses_id","courses_fail","courses_avg"],"ORDER":"courses_avg"}},"isQueryValid":true,"result":[{"courses_avg":53.12,"courses_id":"180","courses_dept":"math","courses_fail":21},{"courses_avg":53.12,"courses_id":"180","courses_dept":"math","courses_fail":21},{"courses_avg":55.26,"courses_id":"180","courses_dept":"math","courses_fail":26},{"courses_avg":55.3,"courses_id":"103","courses_dept":"math","courses_fail":27},{"courses_avg":55.74,"courses_id":"105","courses_dept":"math","courses_fail":21},{"courses_avg":55.74,"courses_id":"184","courses_dept":"math","courses_fail":26},{"courses_avg":56.77,"courses_id":"180","courses_dept":"math","courses_fail":28},{"courses_avg":56.83,"courses_id":"184","courses_dept":"math","courses_fail":22},{"courses_avg":56.83,"courses_id":"184","courses_dept":"math","courses_fail":22},{"courses_avg":57.37,"courses_id":"180","courses_dept":"math","courses_fail":22},{"courses_avg":57.56,"courses_id":"200","courses_dept":"math","courses_fail":22},{"courses_avg":58.04,"courses_id":"105","courses_dept":"math","courses_fail":23},{"courses_avg":58.42,"courses_id":"110","courses_dept":"math","courses_fail":22},{"courses_avg":58.52,"courses_id":"101","courses_dept":"math","courses_fail":24},{"courses_avg":58.9,"courses_id":"101","courses_dept":"math","courses_fail":24},{"courses_avg":58.9,"courses_id":"101","courses_dept":"math","courses_fail":24},{"courses_avg":58.96,"courses_id":"184","courses_dept":"math","courses_fail":22},{"courses_avg":59.32,"courses_id":"200","courses_dept":"math","courses_fail":23},{"courses_avg":59.37,"courses_id":"101","courses_dept":"math","courses_fail":23},{"courses_avg":59.74,"courses_id":"184","courses_dept":"math","courses_fail":24},{"courses_avg":60.17,"courses_id":"180","courses_dept":"math","courses_fail":22},{"courses_avg":60.5,"courses_id":"110","courses_dept":"math","courses_fail":25},{"courses_avg":60.58,"courses_id":"180","courses_dept":"math","courses_fail":29},{"courses_avg":60.9,"courses_id":"100","courses_dept":"math","courses_fail":21},{"courses_avg":61.35,"courses_id":"184","courses_dept":"math","courses_fail":22},{"courses_avg":61.58,"courses_id":"101","courses_dept":"math","courses_fail":21},{"courses_avg":61.75,"courses_id":"101","courses_dept":"math","courses_fail":21},{"courses_avg":61.75,"courses_id":"100","courses_dept":"math","courses_fail":21},{"courses_avg":62.03,"courses_id":"264","courses_dept":"math","courses_fail":29},{"courses_avg":62.17,"courses_id":"152","courses_dept":"math","courses_fail":23},{"courses_avg":62.29,"courses_id":"152","courses_dept":"math","courses_fail":22},{"courses_avg":62.38,"courses_id":"152","courses_dept":"math","courses_fail":22},{"courses_avg":62.4,"courses_id":"184","courses_dept":"math","courses_fail":22},{"courses_avg":62.59,"courses_id":"152","courses_dept":"math","courses_fail":21},{"courses_avg":62.82,"courses_id":"101","courses_dept":"math","courses_fail":21},{"courses_avg":62.89,"courses_id":"104","courses_dept":"math","courses_fail":23},{"courses_avg":62.99,"courses_id":"221","courses_dept":"math","courses_fail":28},{"courses_avg":63.1,"courses_id":"101","courses_dept":"math","courses_fail":23},{"courses_avg":63.12,"courses_id":"264","courses_dept":"math","courses_fail":28},{"courses_avg":63.16,"courses_id":"105","courses_dept":"math","courses_fail":23},{"courses_avg":63.33,"courses_id":"101","courses_dept":"math","courses_fail":22},{"courses_avg":63.36,"courses_id":"200","courses_dept":"math","courses_fail":22},{"courses_avg":63.42,"courses_id":"215","courses_dept":"math","courses_fail":24},{"courses_avg":63.88,"courses_id":"184","courses_dept":"math","courses_fail":26},{"courses_avg":63.89,"courses_id":"101","courses_dept":"math","courses_fail":25},{"courses_avg":63.89,"courses_id":"152","courses_dept":"math","courses_fail":29},{"courses_avg":64.06,"courses_id":"152","courses_dept":"math","courses_fail":21},{"courses_avg":64.09,"courses_id":"221","courses_dept":"math","courses_fail":26},{"courses_avg":64.23,"courses_id":"253","courses_dept":"math","courses_fail":22},{"courses_avg":64.26,"courses_id":"104","courses_dept":"math","courses_fail":23},{"courses_avg":64.3,"courses_id":"215","courses_dept":"math","courses_fail":26},{"courses_avg":64.34,"courses_id":"152","courses_dept":"math","courses_fail":21},{"courses_avg":64.35,"courses_id":"215","courses_dept":"math","courses_fail":22},{"courses_avg":64.53,"courses_id":"300","courses_dept":"math","courses_fail":28},{"courses_avg":64.64,"courses_id":"102","courses_dept":"math","courses_fail":22},{"courses_avg":64.72,"courses_id":"105","courses_dept":"math","courses_fail":27},{"courses_avg":64.76,"courses_id":"200","courses_dept":"math","courses_fail":29},{"courses_avg":64.91,"courses_id":"264","courses_dept":"math","courses_fail":23},{"courses_avg":65.04,"courses_id":"152","courses_dept":"math","courses_fail":27},{"courses_avg":65.21,"courses_id":"300","courses_dept":"math","courses_fail":25},{"courses_avg":65.39,"courses_id":"105","courses_dept":"math","courses_fail":21},{"courses_avg":65.44,"courses_id":"256","courses_dept":"math","courses_fail":21},{"courses_avg":65.52,"courses_id":"180","courses_dept":"math","courses_fail":21},{"courses_avg":65.6,"courses_id":"102","courses_dept":"math","courses_fail":28},{"courses_avg":65.63,"courses_id":"184","courses_dept":"math","courses_fail":24},{"courses_avg":65.71,"courses_id":"200","courses_dept":"math","courses_fail":22},{"courses_avg":65.74,"courses_id":"105","courses_dept":"math","courses_fail":22},{"courses_avg":65.74,"courses_id":"200","courses_dept":"math","courses_fail":21},{"courses_avg":65.99,"courses_id":"100","courses_dept":"math","courses_fail":22},{"courses_avg":66.2,"courses_id":"101","courses_dept":"math","courses_fail":21},{"courses_avg":66.26,"courses_id":"152","courses_dept":"math","courses_fail":24},{"courses_avg":66.32,"courses_id":"101","courses_dept":"math","courses_fail":21},{"courses_avg":66.41,"courses_id":"221","courses_dept":"math","courses_fail":21},{"courses_avg":66.87,"courses_id":"104","courses_dept":"math","courses_fail":23},{"courses_avg":67.03,"courses_id":"152","courses_dept":"math","courses_fail":28},{"courses_avg":67.11,"courses_id":"200","courses_dept":"math","courses_fail":23},{"courses_avg":67.36,"courses_id":"220","courses_dept":"math","courses_fail":23},{"courses_avg":67.53,"courses_id":"104","courses_dept":"math","courses_fail":24},{"courses_avg":67.71,"courses_id":"307","courses_dept":"math","courses_fail":23},{"courses_avg":67.73,"courses_id":"317","courses_dept":"math","courses_fail":21},{"courses_avg":67.77,"courses_id":"307","courses_dept":"math","courses_fail":21},{"courses_avg":67.79,"courses_id":"317","courses_dept":"math","courses_fail":21},{"courses_avg":67.88,"courses_id":"307","courses_dept":"math","courses_fail":23},{"courses_avg":68.02,"courses_id":"100","courses_dept":"math","courses_fail":22},{"courses_avg":68.03,"courses_id":"253","courses_dept":"math","courses_fail":22},{"courses_avg":68.45,"courses_id":"317","courses_dept":"math","courses_fail":21},{"courses_avg":68.73,"courses_id":"220","courses_dept":"math","courses_fail":21},{"courses_avg":68.84,"courses_id":"257","courses_dept":"math","courses_fail":22},{"courses_avg":69.3,"courses_id":"101","courses_dept":"math","courses_fail":24},{"courses_avg":69.53,"courses_id":"317","courses_dept":"math","courses_fail":23},{"courses_avg":69.64,"courses_id":"152","courses_dept":"math","courses_fail":21},{"courses_avg":69.65,"courses_id":"200","courses_dept":"math","courses_fail":21},{"courses_avg":69.94,"courses_id":"101","courses_dept":"math","courses_fail":23},{"courses_avg":70.08,"courses_id":"103","courses_dept":"math","courses_fail":27},{"courses_avg":70.34,"courses_id":"221","courses_dept":"math","courses_fail":26},{"courses_avg":70.42,"courses_id":"100","courses_dept":"math","courses_fail":24},{"courses_avg":70.6,"courses_id":"215","courses_dept":"math","courses_fail":25},{"courses_avg":70.67,"courses_id":"104","courses_dept":"math","courses_fail":24},{"courses_avg":71.27,"courses_id":"215","courses_dept":"math","courses_fail":23},{"courses_avg":74.75,"courses_id":"100","courses_dept":"math","courses_fail":23},{"courses_avg":88,"courses_id":"301","courses_dept":"cpsc","courses_fail":0},{"courses_avg":88,"courses_id":"544","courses_dept":"cpsc","courses_fail":0},{"courses_avg":88,"courses_id":"509","courses_dept":"cpsc","courses_fail":0},{"courses_avg":88,"courses_id":"509","courses_dept":"cpsc","courses_fail":0},{"courses_avg":88,"courses_id":"301","courses_dept":"cpsc","courses_fail":0},{"courses_avg":88,"courses_id":"544","courses_dept":"cpsc","courses_fail":0}]}
