{"id":"Camelot","title":"Should be able to find course average for a course.","description":"This test gets the columns \"courses_dept\" , \"courses_id\", and \"courses_avg\" where \"courses_dept\" is \"cpsc\", \"courses_id\" is 310, sorted by \"courses_avg\"","query":{"WHERE":{"AND":[{"IS":{"courses_dept":"cpsc"}},{"IS":{"courses_id":"310"}}]},"OPTIONS":{"COLUMNS":["courses_dept","courses_id","courses_avg"],"ORDER":"courses_avg"}},"isQueryValid":true,"result":[{"courses_avg":72.27,"courses_id":"310","courses_dept":"cpsc"},{"courses_avg":73.16,"courses_id":"310","courses_dept":"cpsc"},{"courses_avg":74.45,"courses_id":"310","courses_dept":"cpsc"},{"courses_avg":74.99,"courses_id":"310","courses_dept":"cpsc"},{"courses_avg":75.14,"courses_id":"310","courses_dept":"cpsc"},{"courses_avg":75.4,"courses_id":"310","courses_dept":"cpsc"},{"courses_avg":75.54,"courses_id":"310","courses_dept":"cpsc"},{"courses_avg":75.57,"courses_id":"310","courses_dept":"cpsc"},{"courses_avg":75.72,"courses_id":"310","courses_dept":"cpsc"},{"courses_avg":75.8,"courses_id":"310","courses_dept":"cpsc"},{"courses_avg":75.97,"courses_id":"310","courses_dept":"cpsc"},{"courses_avg":76.31,"courses_id":"310","courses_dept":"cpsc"},{"courses_avg":76.52,"courses_id":"310","courses_dept":"cpsc"},{"courses_avg":77.11,"courses_id":"310","courses_dept":"cpsc"},{"courses_avg":77.13,"courses_id":"310","courses_dept":"cpsc"},{"courses_avg":77.63,"courses_id":"310","courses_dept":"cpsc"},{"courses_avg":77.78,"courses_id":"310","courses_dept":"cpsc"},{"courses_avg":77.8,"courses_id":"310","courses_dept":"cpsc"},{"courses_avg":78.22,"courses_id":"310","courses_dept":"cpsc"},{"courses_avg":78.32,"courses_id":"310","courses_dept":"cpsc"},{"courses_avg":78.68,"courses_id":"310","courses_dept":"cpsc"},{"courses_avg":78.68,"courses_id":"310","courses_dept":"cpsc"},{"courses_avg":78.69,"courses_id":"310","courses_dept":"cpsc"},{"courses_avg":79.04,"courses_id":"310","courses_dept":"cpsc"},{"courses_avg":79.12,"courses_id":"310","courses_dept":"cpsc"},{"courses_avg":79.12,"courses_id":"310","courses_dept":"cpsc"},{"courses_avg":79.5,"courses_id":"310","courses_dept":"cpsc"},{"courses_avg":80.24,"courses_id":"310","courses_dept":"cpsc"},{"courses_avg":80.32,"courses_id":"310","courses_dept":"cpsc"},{"courses_avg":80.34,"courses_id":"310","courses_dept":"cpsc"},{"courses_avg":80.34,"courses_id":"310","courses_dept":"cpsc"},{"courses_avg":80.35,"courses_id":"310","courses_dept":"cpsc"},{"courses_avg":81.17,"courses_id":"310","courses_dept":"cpsc"},{"courses_avg":81.17,"courses_id":"310","courses_dept":"cpsc"},{"courses_avg":81.18,"courses_id":"310","courses_dept":"cpsc"},{"courses_avg":81.88,"courses_id":"310","courses_dept":"cpsc"},{"courses_avg":81.88,"courses_id":"310","courses_dept":"cpsc"},{"courses_avg":84.6,"courses_id":"310","courses_dept":"cpsc"},{"courses_avg":84.6,"courses_id":"310","courses_dept":"cpsc"}]}
